{
 "schema": "nuvec-mrun-canary",
 "schema_version": 1,
 "created": "2026-10-23T10:05:35+00:00",
 "environment": {
  "machine": "Mac16,7",
  "chip": "Apple M4 Pro",
  "cpu_cores": {
   "performance": 10,
   "efficiency": 4
  },
  "gpu_cores": 20,
  "memory_bytes": 51539607552,
  "macos": {
   "version": "26.6.2",
   "build": "25G83"
  },
  "power": {
   "source": "ac",
   "low_power_mode": false
  },
  "swap_used_bytes_at_start": 19463866941,
  "nuvec": {
   "version": "0.4.0",
   "commit": "76ad586e4a669c9cdedc15075d74e7574c1dc592",
   "dirty": true
  },
  "rust": "rustc 1.99.0 (b940084d7 2026-09-28)",
  "mlx": "0.32.4",
  "mlx_lm": "0.32.2",
  "python": "3.13.12"
 },
 "mrun": {
  "commit": "98d3a90123b487808665e82963d901a602131b06",
  "ref_file": "ci/mrun.ref"
 },
 "nuvec": {
  "version": "0.4.0",
  "commit": "76ad586e4a669c9cdedc15075d74e7574c1dc592",
  "dirty": true
 },
 "status": "build-failed",
 "reason": "mrun 98d3a90123b487808665e82963d901a602131b06 has no nuvec dependency to point at this tree (ci/mrun.ref is marked pre-port: expected until mrun is ported)"
}
